{
  "schemaVersion": "1.0.0",
  "generated": "2026-10-12T21:05:00+11:00",
  "scope": {
    "focusComparison": [
      "Beta 1.7.3 (released 2011-07-08)",
      "Beta 1.8.1 (released 2011-09-15, last Beta)"
    ],
    "targetEmulationRange": [
      "Pre-Classic (Cave game tech test, rd-132211 etc.)",
      "Classic (0.0.x-0.30)",
      "Indev",
      "Infdev",
      "Alpha (v1.0.x-v1.2.6)",
      "Beta 1.0-Beta 1.8.1 (no Beta '1.7.10' release exists: the 1.7 line ends at Beta 1.7.3)",
      "Release 1.0.0-1.7.10"
    ],
    "inScope": [
      "Gameplay/behaviour deltas that a historical profile must parameterise (food/hunger, movement, combat, mob drops, spawning, recipes, progression, HUD, worldgen-adjacent flags)",
      "Both the Beta 1.7.3 baseline and the Beta 1.8/Beta 1.8.1 target state, plus later 1.x changes needed to separate the two",
      "Primary-artifact verification from Mojang's official client jars where a bytecode/decompile check was possible",
      "Explicit version-naming note: 'Release 1.7.10' is a Release-era version; the Beta-era 1.7 line ended at Beta 1.7.3. Source: https://minecraft.wiki/index.php?title=Java_Edition_version_history&action=raw (Beta section lists Beta 1.8.1, 1.8, 1.7.3, 1.7.2, 1.7 and earlier - no 1.7.4-1.7.10)."
    ],
    "outOfScope": [
      "Terrain generation algorithms (Moderner Beta is the terrain authority; see AGENTS.md)",
      "Runtime/Java/build changes and any modification of .upstream/moderner-beta",
      "Redistribution of Mojang code or assets; only numeric facts and citations are recorded here",
      "Bedrock/Education/Legacy Console behaviour except where it explains a Java Edition contradiction"
    ]
  },
  "categories": [
    "food_hunger",
    "movement_water",
    "combat",
    "mobs",
    "mob_drops",
    "spawning",
    "crafting_recipes",
    "worldgen",
    "structures",
    "progression",
    "hud_ui",
    "lighting_visuals",
    "technical"
  ],
  "confidenceLevels": {
    "high": "Confirmed by at least one primary artifact (official Mojang client jar bytecode/decompile/version JSON) or by two independent sources that agree.",
    "medium": "Confirmed by a single secondary source (wiki raw wikitext, developer statement) not independently corroborated, or confirmed for a neighbouring version and inferred.",
    "low": "Weakly sourced, reported indirectly, or reconstructed by reasoning from adjacent facts; do not ship behaviour on this alone.",
    "unknown": "No usable source found. Recorded so the gap stays visible; must not be implemented from assumption."
  },
  "implementationStatuses": {
    "not_started": "No code in this repository implements or parameterises the feature (true for every entry at this milestone).",
    "partial": "Some scaffolding exists but behaviour is not complete or not verified.",
    "implemented": "Behaviour implemented and verified against the cited evidence.",
    "unknown": "Implementation state could not be determined.",
    "not_applicable": "Not a behaviour to implement (documentation-only note)."
  },
  "validation": {
    "entryCount": 46,
    "categoryCounts": {
      "combat": 6,
      "crafting_recipes": 2,
      "food_hunger": 12,
      "hud_ui": 2,
      "lighting_visuals": 1,
      "mob_drops": 6,
      "mobs": 2,
      "movement_water": 4,
      "progression": 1,
      "spawning": 1,
      "structures": 3,
      "technical": 1,
      "worldgen": 5
    },
    "confidenceCounts": {
      "high": 32,
      "low": 1,
      "medium": 11,
      "unknown": 2
    },
    "implementationStatusCounts": {
      "not_started": 46
    }
  },
  "entries": [
    {
      "id": "beta173-instant-food-healing",
      "name": "Direct healing from food (no hunger bar) - food-by-food model",
      "category": "food_hunger",
      "verificationStatus": "documented_only",
      "firstSupportedVersion": "unknown (food-by-food accumulation)",
      "firstSupportedPrecise": null,
      "removedIn": "Beta 1.8",
      "changes": [
        {
          "version": "Indev 20100110",
          "precise": "20100110",
          "change": "Apples become edible and restore 4 HP directly (earliest confirmed direct-healing food in this pass)."
        },
        {
          "version": "Indev 20100206-2034",
          "precise": "20100206-2034",
          "change": "Bread added, restoring 5 HP directly; mushroom stew raised to 10 HP in the same build. This is the build previously written as this entry's firstSupportedVersion - kept as a change entry instead, because the feature is a per-food model rather than one dated mechanic."
        },
        {
          "version": "Indev 20100219",
          "precise": "20100219",
          "change": "Pigs drop raw porkchops (3 HP); smelting yields cooked porkchops (8 HP)."
        },
        {
          "version": "Beta 1.2",
          "precise": null,
          "change": "Cake added; a slice restores 3 HP, a full cake 18 HP."
        },
        {
          "version": "Beta 1.4",
          "precise": null,
          "change": "Cookies added, restore 1 HP."
        },
        {
          "version": "Beta 1.8",
          "precise": "Beta 1.8 pre-release",
          "change": "Food no longer restores health directly; eating fills a new hunger bar instead."
        }
      ],
      "values": [
        {
          "key": "hungerFieldsPresentInClient",
          "value": false,
          "unit": "boolean",
          "appliesToVersions": [
            "Beta 1.7.3"
          ],
          "confidence": "high",
          "note": "Byte-scan of the official b1.7.3 client jar for the strings foodLevel/foodSaturationLevel/foodExhaustionLevel returned 0 matches in 747 classes."
        },
        {
          "key": "foodRegistryEntriesPresentInClient",
          "value": [
            "apple",
            "bread",
            "porkchopRaw",
            "porkchopCooked",
            "appleGold",
            "fishRaw",
            "fishCooked",
            "cookie",
            "mushroomStew",
            "shears",
            "feather",
            "leather"
          ],
          "unit": "registry names",
          "appliesToVersions": [
            "Beta 1.7.3"
          ],
          "confidence": "high",
          "note": "Presence of these item-registry string constants in the single item-registry class gm.class of the official b1.7.3 client. This is registry-class inspection, not a whole-client string scan."
        },
        {
          "key": "foodRegistryEntriesAbsentInClient",
          "value": [
            "rottenFlesh",
            "beefRaw",
            "beefCooked",
            "chickenRaw",
            "chickenCooked",
            "melon",
            "enderPearl"
          ],
          "unit": "registry names",
          "appliesToVersions": [
            "Beta 1.7.3"
          ],
          "confidence": "high",
          "note": "These registry-name strings were NOT found in the b1.7.3 client's classes and all appear in the b1.8 registry class sv.class. Registry-string absence is evidence about the item registry; it is not a general proof that no related behaviour exists elsewhere in obfuscated code."
        }
      ],
      "evidence": [
        {
          "kind": "wiki_raw_wikitext",
          "url": "https://minecraft.wiki/index.php?title=Food&action=raw",
          "reference": "History / Java Edition, Indev and Beta lines: 20100206-2034, 20100219, 1.2, 1.4, and '1.8|dev=Pre-release Hunger was introduced. Food no longer restores health directly...'",
          "supports": "Direct healing model per version and its replacement in Beta 1.8.",
          "retrieved": "2026-10-12"
        },
        {
          "kind": "wiki_raw_wikitext",
          "url": "https://minecraft.wiki/index.php?title=Java_Edition_Beta_1.7.3&action=raw",
          "reference": "Trivia: this was the last version to 'not have the Food bar system'",
          "supports": "Beta 1.7.3 has no hunger bar.",
          "retrieved": "2026-10-12"
        },
        {
          "kind": "official_client_artifact",
          "url": "https://launcher.mojang.com/v1/objects/43db9b498cb67058d2e12d394e6507722e71bb45/client.jar",
          "reference": "Byte-scan of all 747 classes for the string constants 'foodLevel', 'foodSaturationLevel', 'foodExhaustionLevel' and 'starve': 0 string matches. Read as absence of those strings (which is what the two sources independently corroborate); not as a general proof of behavioural absence in obfuscated code.",
          "supports": "Official b1.7.3 client contains no hunger subsystem.",
          "retrieved": "2026-10-12",
          "sha1": "43db9b498cb67058d2e12d394e6507722e71bb45"
        }
      ],
      "confidence": "high",
      "confidenceReason": "The disappearance of direct healing in Beta 1.8 is artifact-verified (no hunger fields in the b1.7.3 client, hunger subsystem present in b1.8); the per-food HP values are wiki-sourced only, and the first-supported version is explicitly unknown because the model accumulated food by food.",
      "unknowns": [
        "No source consulted pins the FIRST direct-healing food exactly: mushrooms were edible in Classic 0.24_SURVIVAL_TEST (5 HP brown / -3 HP red), apples became edible in Indev 20100110, mushroom stew was added 20100129-2332 (8 HP), bread 20100206-2034 (5 HP). The correct 'first supported version' for the direct-heal MODEL is therefore a judgement call and is recorded as unknown rather than asserted.",
        "Per-food HP restore values for every Beta 1.7.3 food were not re-derived from the b1.7.3 artifact in this pass."
      ],
      "implementationStatus": "not_started",
      "coverage": {
        "coversProfile": [
          "beta-1.7.3"
        ],
        "modernBehaviourDifference": "Minecraft 26.3 always uses the hunger model; there is no direct-heal path, so the profile must disable hunger and route eating to instant health restoration.",
        "requiresHostWorkaround": true
      },
      "risks": [